<?xml version="1.0" encoding="UTF-8"?>

<!-- *****************************************************************
-->
<!--                                                                   -->
<!-- Copyright IBM Corp. 2001, 2011  All Rights Reserved.              -->
<!--
-->

<config id="widgets"
    xmlns="http://www.ibm.com/widgets-config" 
    xmlns:tns="http://www.ibm.com/widgets-config" 
    xmlns:xsi="http://www.w3.org/2001/XMLSchema-instance"
    xsi:schemaLocation="http://www.ibm.com/widgets-config widgets-config.xsd">
<!-- 
    Examples widgets: not supported officially but can be used as examples
    <widgetDef defId="AdditionalInfo" modes="view edit" showInPalette="false" url="{communitiesSvcRef}/widgets/widgets/additionalInfo/additional-info.xml?version={version}" />
    
    <widgetDef defId="FeedReader" modes="view edit" url="{communitiesSvcRef}/widgets/widgets/feedReader/feedreader.xml?version={version}" description="feedReaderDescription"/>
    
    // a widget with a fullpage mode
    <widgetDef defId="HelloWorld" primaryWidget="false" modes="view fullpage edit search"  url="{communitiesSvcRef}/comm.widgets/helloWorld/HelloWorld.xml?version={version}"/>
    
    // a widget with an external jsp as a full page
    <widgetDef defId="HelloWorld" primaryWidget="false" modes="view edit search"  url="{communitiesSvcRef}/comm.widgets/helloWorld/HelloWorld.xml?version={version}"
        navBarLink="{communitiesSvcRef}/comm.widgets/helloWorld/HelloWorld.jsp?resourceId={resourceId}&amp;version={version}"/>
-->
         
    <resource type="profile" aclServiceImpl="com.ibm.lconn.profiles.internal.acl.ProfilesACLServiceImpl"
        xpathMandatedWidgetForMainPage="/tns:config//tns:resource[@type='profile']/tns:widgets/tns:layout/tns:page[@pageId = 'profilesView']">      

        <widgets xmlns:tns="http://www.ibm.com/widgets-config">
          <definitions>
              <widgetDef defId="reportStructure" url="{contextRoot}/widget-catalog/report-chain.xml?version={version}"
                    helpLink="{helpSvcRef}/topic/com.ibm.lotus.connections.profiles.help/c_pers_profiles.html">
                <itemSet>
                  <item name="numberOfNameToDisplay" value="4" />
                </itemSet>
              </widgetDef>
              <widgetDef defId="multiFeedReader" url="{contextRoot}/widget-catalog/multifeedreader.xml?version={version}" 
                    helpLink="{helpSvcRef}/topic/com.ibm.lotus.connections.profiles.help/c_pers_profiles.html" >
                <itemSet>
                    <item name="numberOfEntriesToDisplay" value="5" />
                    <item name="communityResourceId" value="communityResourceId"/>
                    <item name="communityFeedUrl" value="{communitiesSvcRef}/service/atom/communities/all?userid={userid}&amp;ps=5"/>
                    <item name="dogearResourceId" value="dogearResourceId"/>
                    <item name="dogearFeedUrl"    value="{dogearSvcRef}/atom?userid={userid}&amp;access=any&amp;sort=date&amp;sortOrder=desc&amp;ps=5&amp;showFavIcon=true{appLangParam}"/>
                    <item name="blogsResourceId" value="blogsResourceId"/>
                    <item name="blogsFeedUrl"    value="{blogsSvcRef}/atom?userid={userid}&amp;ps=5"/>
                    <item name="activitiesResourceId" value="activitiesResourceId"/>
                    <item name="activitiesFeedUrl"    value="{activitiesSvcRef}/service/atom2/activities?public=only&amp;userid={userid}&amp;authenticate=no&amp;ps=5"/>
                    <item name="filesResourceId" value="filesResourceId"/>
                    <item name="filesFeedUrl"    value="{filesSvcRef}/basic/anonymous/api/userlibrary/{userid}/feed?pagesize=5"/>
                    <item name="forumsResourceId" value="label.personcard.forumlink"/>
                    <item name="forumsFeedUrl"    value="{searchSvcRef}/atom/search/results?component=forums&amp;person={userid}&amp;page=1&amp;ps=5"/>
                    <item name="wikiResourceId" value="wikiResourceId"/>
                    <item name="wikiFeedUrl"    value="{wikisSvcRef}/basic/anonymous/api/wikis/person/{userid}/feed?pagesize=5"/>
                </itemSet>
              </widgetDef>
              <widgetDef defId="friends" url="{contextRoot}/widget-catalog/friends.xml?version={version}" modes="view fullpage"  
                helpLink="{helpSvcRef}/topic/com.ibm.lotus.connections.profiles.help/t_pers_view_colleagues.html"/>
              <widgetDef defId="follow" url="{contextRoot}/widget-catalog/follow.xml?version={version}" modes="view fullpage"  
                helpLink="{helpSvcRef}/topic/com.ibm.lotus.connections.profiles.help/t_pers_view_colleagues.html"/>
              <widgetDef defId="linkRoll" url="{contextRoot}/widget-catalog/linkroll.xml?version={version}"
                helpLink="{helpSvcRef}/topic/com.ibm.lotus.connections.profiles.help/c_pers_profiles.html"/>
              <widgetDef defId="socialTags" url="{contextRoot}/widget-catalog/tags.xml?version={version}" 
                helpLink="{helpSvcRef}/topic/com.ibm.lotus.connections.profiles.help/c_pers_tags.html"/>
              <widgetDef defId="commonTags" url="{contextRoot}/widget-catalog/common-tags.xml?version={version}" 
                helpLink="{helpSvcRef}/topic/com.ibm.lotus.connections.profiles.help/c_pers_tags.html"/>      
                          
            <widgetDef defId="sand_DYK" bundleRefId="lc_sand" url="{sandSvcRef}/static/{version}/descriptors/DYK.xml"
                prerequisite="sand" displayLoginRequired="true" 
                helpLink="{helpSvcRef}/topic/com.ibm.lotus.connections.profiles.help/t_pers_using_dyk_widget.html">
                <itemSet>
                  <item name="profilesRoot" value="{contextRoot}"/>
                  <item name="profilesBlank" value="{contextRoot}/nav/common/styles/images/blank.gif"/>
                  <item name="sandUIRoot" value="{sandSvcRef}/static/{version}/" />
                  <item name="sandBackEndRoot" value="{searchSvcRef}" />
                  <item name="xhrErrorHandlerAsString" value="lconn.core.errorhandling.DefaultXHRErrorHandler" />
                  <item name="inviteErrorHandler" value="lconn.core.errorhandling.DefaultErrorHandler" />
                  <item name="inviteXHRErrorHandler" value="lconn.core.errorhandling.DefaultXHRErrorHandler" />
               </itemSet>
            </widgetDef> 
            <widgetDef defId="sand_recomItems" bundleRefId="lc_sand" url="{sandSvcRef}/static/{version}/descriptors/Recommend.xml"
                prerequisite="sand" displayLoginRequired="true">
                <itemSet>
                  <item name="sandUIRoot" value="{sandSvcRef}/static/{version}/" />
                  <item name="sandBackEndRoot" value="{searchSvcRef}" />
                  <item name="sourceList" value="blogs,communities,wikis,files,dogear" />
                  <item name="ApiUrl" value="{searchSvcRef}/api/sand/recommend" />
                  <item name="navContentLocation" value="{contextRoot}/nav" />
                  <item name="xhrErrorHandlerAsString" value="lconn.core.errorhandling.DefaultXHRErrorHandler" />
               </itemSet>
            </widgetDef> 
            
            <widgetDef defId="sand_thingsInCommon" bundleRefId="lc_sand" url="{sandSvcRef}/static/{version}/descriptors/sharedLC.xml"
                prerequisite="sand" displayLoginRequired="true" hideWidgetForMyProfile="true" 
                helpLink="{helpSvcRef}/topic/com.ibm.lotus.connections.profiles.help/t_pers_using_tic_widget.html">
                <itemSet>
                  <item name="sandUIRoot" value="{sandSvcRef}/static/{version}/" />
                  <item name="sandBackEndRoot" value="{searchSvcRef}" />
               </itemSet>
            </widgetDef> 
             
            <widgetDef defId="sand_socialPath" bundleRefId="lc_sand" url="{sandSvcRef}/static/{version}/descriptors/socialPath.xml" 
                prerequisite="sand" displayLoginRequired="true" hideWidgetForMyProfile="true" 
                helpLink="{helpSvcRef}/topic/com.ibm.lotus.connections.profiles.help/t_pers_using_sp_widget.html">
                <itemSet>
                  <item name="sandUIRoot" value="{sandSvcRef}/static/{version}/" />
                  <item name="sandBackEndRoot" value="{searchSvcRef}" />
               </itemSet>
            </widgetDef>
            <widgetDef defId="multiWidget" url="{contextRoot}/widget-catalog/multiWidget.xml?version={version}" skinType="skinless" modes="view">
                <itemSet>
                  <item name="containerRecurranceType" value="tabs" />
                </itemSet>
            </widgetDef>            
            <widgetDef defId="board" url="{contextRoot}/widget-catalog/wall.xml?version={version}" modes="view fullpage" 
                helpLink="{helpSvcRef}/topic/com.ibm.lotus.connections.profiles.help/c_pers_wall_intro.html" />
            <widgetDef defId="contactInfo" url="{contextRoot}/widget-catalog/contact-info.xml?version={version}" modes="view fullpage" 
                helpLink="{helpSvcRef}/topic/com.ibm.lotus.connections.profiles.help/c_pers_profiles.html" />
            <widgetDef defId="backgroundInfo" url="{contextRoot}/widget-catalog/background-info.xml?version={version}" modes="view fullpage" 
                helpLink="{helpSvcRef}/topic/com.ibm.lotus.connections.profiles.help/c_pers_profiles.html" />
          </definitions>
         <layout resourceSubType="temp">
              <page pageId="profilesView">
		<widgetInstance uiLocation="col2" defIdRef="multiWidget" instanceId="block4"/>
                <widgetInstance uiLocation="block4" defIdRef="board"/>
                <widgetInstance uiLocation="block4" defIdRef="contactInfo"/>
               	<widgetInstance uiLocation="col2" defIdRef="multiWidget" instanceId="block5"/>
                <widgetInstance uiLocation="block5" defIdRef="backgroundInfo"/>